{
  "schema_version": "1.0.0",
  "project_id": "modular-synth-turntable-studio-1970s",
  "units": {
    "source_unit_m": 0.1,
    "runtime_unit_m": 1.0,
    "rack_width_m": 0.8,
    "rack_width_source_units": 8.0,
    "rack_backward_tilt_deg": 15.0
  },
  "dimensions": {
    "rack_width_m": 0.8,
    "rack_height_m": 0.42,
    "rack_depth_m": 0.38,
    "keyboard_bed_depth_m": 0.18,
    "turntable_plinth_width_m": 0.42,
    "turntable_plinth_depth_m": 0.35,
    "turntable_platter_diameter_m": 0.3
  },
  "axis_conversion": {
    "blender_axes": {
      "right": "+X",
      "back": "+Y",
      "forward_to_operator": "-Y",
      "up": "+Z"
    },
    "threejs_axes": {
      "right": "+X",
      "up": "+Y",
      "forward_to_operator": "+Z"
    },
    "gltf_export_yup": true,
    "position_mapping": "three_x = blender_x; three_y = blender_z; three_z = -blender_y",
    "rotation_mapping": "Faceplate tilted -15 deg around +X in Three.js (+15 deg in Blender); knobs childed to Synth_Faceplate_Frame rotate around local Z axis; keys childed to Synth_Keybed_Frame rotate around local +X rear hinge axis; platter rotates around local +Y axis."
  },
  "knobs": [
    {
      "id": "knob_vco1_pitch",
      "node_name": "Knob_01_VCO1_Pitch",
      "module": "VCO",
      "label": "VCO 1 TUNE",
      "parameter": "vco1.pitchSemitones",
      "unit": "st",
      "min": -24.0,
      "max": 24.0,
      "default": 0.0,
      "scale": "linear",
      "smoothing_tc_s": 0.015,
      "pivot_axis_threejs": "Z",
      "angle_min_deg": -135.0,
      "angle_max_deg": 135.0,
      "panel_local_pos_m": [
        -0.345,
        0.095,
        0.012
      ]
    },
    {
      "id": "knob_vco1_wave",
      "node_name": "Knob_02_VCO1_Wave",
      "module": "VCO",
      "label": "VCO 1 WAVE",
      "parameter": "vco1.waveformMorph",
      "unit": "shape",
      "min": 0.0,
      "max": 1.0,
      "default": 0.67,
      "scale": "linear",
      "smoothing_tc_s": 0.02,
      "pivot_axis_threejs": "Z",
      "angle_min_deg": -135.0,
      "angle_max_deg": 135.0,
      "panel_local_pos_m": [
        -0.245,
        0.095,
        0.012
      ]
    },
    {
      "id": "knob_vco2_detune",
      "node_name": "Knob_03_VCO2_Detune",
      "module": "VCO",
      "label": "VCO 2 DETUNE",
      "parameter": "vco2.detuneCents",
      "unit": "ct",
      "min": -1200.0,
      "max": 1200.0,
      "default": 8.0,
      "scale": "linear",
      "smoothing_tc_s": 0.015,
      "pivot_axis_threejs": "Z",
      "angle_min_deg": -135.0,
      "angle_max_deg": 135.0,
      "panel_local_pos_m": [
        -0.345,
        0.01,
        0.012
      ]
    },
    {
      "id": "knob_vco2_mix",
      "node_name": "Knob_04_VCO2_Mix",
      "module": "VCO",
      "label": "VCO 2 / SUB MIX",
      "parameter": "vco2.subMix",
      "unit": "lvl",
      "min": 0.0,
      "max": 1.0,
      "default": 0.45,
      "scale": "linear",
      "smoothing_tc_s": 0.02,
      "pivot_axis_threejs": "Z",
      "angle_min_deg": -135.0,
      "angle_max_deg": 135.0,
      "panel_local_pos_m": [
        -0.245,
        0.01,
        0.012
      ]
    },
    {
      "id": "knob_vcf_cutoff",
      "node_name": "Knob_05_VCF_Cutoff",
      "module": "VCF",
      "label": "CUTOFF FREQ",
      "parameter": "vcf.cutoffHz",
      "unit": "Hz",
      "min": 40.0,
      "max": 16000.0,
      "default": 1200.0,
      "scale": "log",
      "smoothing_tc_s": 0.015,
      "pivot_axis_threejs": "Z",
      "angle_min_deg": -135.0,
      "angle_max_deg": 135.0,
      "panel_local_pos_m": [
        -0.145,
        0.095,
        0.012
      ]
    },
    {
      "id": "knob_vcf_resonance",
      "node_name": "Knob_06_VCF_Resonance",
      "module": "VCF",
      "label": "RESONANCE",
      "parameter": "vcf.resonanceQ",
      "unit": "Q",
      "min": 0.7,
      "max": 18.0,
      "default": 2.8,
      "scale": "linear",
      "smoothing_tc_s": 0.015,
      "pivot_axis_threejs": "Z",
      "angle_min_deg": -135.0,
      "angle_max_deg": 135.0,
      "panel_local_pos_m": [
        -0.045,
        0.095,
        0.012
      ]
    },
    {
      "id": "knob_vcf_env_amt",
      "node_name": "Knob_07_VCF_EnvAmt",
      "module": "VCF",
      "label": "ENV MOD DEPTH",
      "parameter": "vcf.envModCents",
      "unit": "ct",
      "min": -4800.0,
      "max": 4800.0,
      "default": 2200.0,
      "scale": "linear",
      "smoothing_tc_s": 0.02,
      "pivot_axis_threejs": "Z",
      "angle_min_deg": -135.0,
      "angle_max_deg": 135.0,
      "panel_local_pos_m": [
        -0.145,
        0.01,
        0.012
      ]
    },
    {
      "id": "knob_vcf_drive",
      "node_name": "Knob_08_VCF_Drive",
      "module": "VCF",
      "label": "LADDER DRIVE",
      "parameter": "vcf.drive",
      "unit": "x",
      "min": 1.0,
      "max": 5.0,
      "default": 1.5,
      "scale": "linear",
      "smoothing_tc_s": 0.02,
      "pivot_axis_threejs": "Z",
      "angle_min_deg": -135.0,
      "angle_max_deg": 135.0,
      "panel_local_pos_m": [
        -0.045,
        0.01,
        0.012
      ]
    },
    {
      "id": "knob_env_attack",
      "node_name": "Knob_09_ENV_Attack",
      "module": "ENV",
      "label": "ATTACK",
      "parameter": "env.attackS",
      "unit": "s",
      "min": 0.003,
      "max": 2.5,
      "default": 0.015,
      "scale": "log",
      "smoothing_tc_s": 0.01,
      "pivot_axis_threejs": "Z",
      "angle_min_deg": -135.0,
      "angle_max_deg": 135.0,
      "panel_local_pos_m": [
        0.055,
        0.095,
        0.012
      ]
    },
    {
      "id": "knob_env_decay",
      "node_name": "Knob_10_ENV_Decay",
      "module": "ENV",
      "label": "DECAY",
      "parameter": "env.decayS",
      "unit": "s",
      "min": 0.02,
      "max": 3.0,
      "default": 0.35,
      "scale": "log",
      "smoothing_tc_s": 0.01,
      "pivot_axis_threejs": "Z",
      "angle_min_deg": -135.0,
      "angle_max_deg": 135.0,
      "panel_local_pos_m": [
        0.155,
        0.095,
        0.012
      ]
    },
    {
      "id": "knob_env_sustain",
      "node_name": "Knob_11_ENV_Sustain",
      "module": "ENV",
      "label": "SUSTAIN",
      "parameter": "env.sustainLevel",
      "unit": "lvl",
      "min": 0.0,
      "max": 1.0,
      "default": 0.6,
      "scale": "linear",
      "smoothing_tc_s": 0.01,
      "pivot_axis_threejs": "Z",
      "angle_min_deg": -135.0,
      "angle_max_deg": 135.0,
      "panel_local_pos_m": [
        0.055,
        0.01,
        0.012
      ]
    },
    {
      "id": "knob_env_release",
      "node_name": "Knob_12_ENV_Release",
      "module": "ENV",
      "label": "RELEASE",
      "parameter": "env.releaseS",
      "unit": "s",
      "min": 0.01,
      "max": 4.0,
      "default": 0.45,
      "scale": "log",
      "smoothing_tc_s": 0.01,
      "pivot_axis_threejs": "Z",
      "angle_min_deg": -135.0,
      "angle_max_deg": 135.0,
      "panel_local_pos_m": [
        0.155,
        0.01,
        0.012
      ]
    },
    {
      "id": "knob_lfo_rate",
      "node_name": "Knob_13_LFO_Rate",
      "module": "LFO_DELAY",
      "label": "LFO RATE",
      "parameter": "lfo.rateHz",
      "unit": "Hz",
      "min": 0.1,
      "max": 20.0,
      "default": 3.5,
      "scale": "log",
      "smoothing_tc_s": 0.02,
      "pivot_axis_threejs": "Z",
      "angle_min_deg": -135.0,
      "angle_max_deg": 135.0,
      "panel_local_pos_m": [
        0.255,
        0.095,
        0.012
      ]
    },
    {
      "id": "knob_lfo_depth",
      "node_name": "Knob_14_LFO_Depth",
      "module": "LFO_DELAY",
      "label": "LFO DEPTH",
      "parameter": "lfo.depth",
      "unit": "lvl",
      "min": 0.0,
      "max": 1.0,
      "default": 0.2,
      "scale": "linear",
      "smoothing_tc_s": 0.02,
      "pivot_axis_threejs": "Z",
      "angle_min_deg": -135.0,
      "angle_max_deg": 135.0,
      "panel_local_pos_m": [
        0.345,
        0.095,
        0.012
      ]
    },
    {
      "id": "knob_dly_time",
      "node_name": "Knob_15_DLY_Time",
      "module": "LFO_DELAY",
      "label": "DELAY TIME",
      "parameter": "delay.timeS",
      "unit": "s",
      "min": 0.04,
      "max": 0.85,
      "default": 0.3,
      "scale": "linear",
      "smoothing_tc_s": 0.035,
      "pivot_axis_threejs": "Z",
      "angle_min_deg": -135.0,
      "angle_max_deg": 135.0,
      "panel_local_pos_m": [
        0.255,
        0.01,
        0.012
      ]
    },
    {
      "id": "knob_dly_mix",
      "node_name": "Knob_16_DLY_Mix",
      "module": "LFO_DELAY",
      "label": "DELAY MIX",
      "parameter": "delay.wetMix",
      "unit": "lvl",
      "min": 0.0,
      "max": 0.85,
      "default": 0.25,
      "scale": "linear",
      "smoothing_tc_s": 0.02,
      "pivot_axis_threejs": "Z",
      "angle_min_deg": -135.0,
      "angle_max_deg": 135.0,
      "panel_local_pos_m": [
        0.345,
        0.01,
        0.012
      ]
    }
  ],
  "patch_sockets": [
    {
      "id": "socket_vco1_out",
      "node_name": "Socket_01_VCO1_Out",
      "module": "VCO",
      "label": "VCO 1 OUT",
      "direction": "output",
      "port_type": "audio_out",
      "signal_range": "-1.0 to +1.0 audio",
      "web_audio_node": "vco1OutGain",
      "panel_local_pos_m": [
        -0.325,
        -0.076,
        0.008
      ]
    },
    {
      "id": "socket_vco2_out",
      "node_name": "Socket_02_VCO2_Out",
      "module": "VCO",
      "label": "VCO 2 OUT",
      "direction": "output",
      "port_type": "audio_out",
      "signal_range": "-1.0 to +1.0 audio",
      "web_audio_node": "vco2OutGain",
      "panel_local_pos_m": [
        -0.195,
        -0.076,
        0.008
      ]
    },
    {
      "id": "socket_vcf_out",
      "node_name": "Socket_03_VCF_Out",
      "module": "VCF",
      "label": "VCF OUT",
      "direction": "output",
      "port_type": "audio_out",
      "signal_range": "-1.0 to +1.0 audio",
      "web_audio_node": "vcfOutGain",
      "panel_local_pos_m": [
        -0.065,
        -0.076,
        0.008
      ]